item	site	category	subcategory	description
Lansseax's Glaive	Elden Ring Wiki	Magic	Incantations	"Incantation that channels the power of the ancient dragon Lansseax.
Creates a red-lightning glaive and sweeps the area from above.This attack unleashes trails of lightning.
Lansseax was the sister of Fortissax. It is said that she took the form of a human to commune with the knights as a priestess of the ancient dragon cult.
"
Shard Spiral	Elden Ring Wiki	Magic	Sorceries	"One of the glintstone sorceries of the Academy of Raya Lucaria.
Fires twin projectiles that form a spiral as they travel. This sorcery can be cast repeatedly and while in motion.
Charging enhances potency.
A sorcery of the Karolos Conspectus, the most venerable of the academy. This was the product of a failed attempt to create a new comet.
"
Unseen Blade	Elden Ring Wiki	Magic	Sorceries	"One of the night sorceries of Sellia, Town of Sorcery.
Enchants armament held in right hand, making it completely invisible.This sorcery can be cast while in motion.
Used by Sellian assassins to present themselves as unarmed sorcerers.
"
Flame Protect Me	Elden Ring Wiki	Magic	Incantations	"The most ancient of the Fire Monks' incantations.
Creates a fire within that greatly increases fire damage negation.
It is said that this incantation was used during the War against the
 Giants long ago, during which it protected the champions of the 
Erdtree.
"
Borealis's Mist	Elden Ring Wiki	Magic	Incantations	"Superior incantation of Dragon Communion.
Channels the power of Borealis, the Freezing Fog.
Transforms caster into a dragon to spew icy breath from above.
Charging extends duration. This incantation can be cast while
jumping.
The ice dragons were once lords of the mountaintops long ago,
until they were defeated by the Fire Giants and chased from the
"
Night Shard	Elden Ring Wiki	Magic	Sorceries	"One of the night sorceries of Sellia, Town of Sorcery.
Swiftly fires a semi-invisible projectile. This sorcery can be used without delay after performing another action.
The Sellian sorcerers were assassins, and it is said that they often hunted their fellows.
"
Dragonbolt Blessing	Elden Ring Wiki	Magic	Incantations	"Superior incantation of the capital's ancient dragon cult.
Summons lightning to bolster the caster's body. Attacks become easier to deflect and resistance to all ailments is increased. However, lightning damage negation will be reduced.
Only those loved by dragons can survive the ordeal of cladding their bodies in lightning.
"
Shadow Bait	Elden Ring Wiki	Magic	Incantations	"Incantation of the Two Fingers' servants, who once served as the
assassins of the Roundtable Hold.
Creates a pale gold shadow before the caster, luring foes of human
build and attracting their aggression.
This incantation can be cast while in motion or crouching, and
will still affect foes that are already in a combat state.
It is said that those beguiled by the shadow see within it a hated
"
Poison Mist	Elden Ring Wiki	Magic	Incantations	"Incantation of the servants of rot.
Releases a poisonous mist before the caster.This incantation can be cast while in motion.
Those who dwell within poison know rot all too well. The death that begets life, that comes to all equally. That is to say: it is the cycle of rebirth put into practice.
"
Black Flame Blade	Elden Ring Wiki	Magic	Incantations	"A black flame incantation of the Godskin Apostles.
Engulfs armament held in the right hand with black flame. This incantation can be cast without delay after performing another action.
Black flame is weighty. After dealing damage it continues to sap foes' HP for a very short time.
"
Radagon's Rings of Light	Elden Ring Wiki	Magic	Incantations	"One of the incantations of the Golden Order fundamentalists.
A gift of gratitude to the young Miquella from his father,
Radagon.
Produces a golden ring of light and fires it across a wide area.
Charging enhances range.
And yet, the young Miquella abandoned fundamentalism, for it
could do nothing to treat Malenia's accursed rot. This was the
beginning of unalloyed gold.
"
Glintblade Phalanx	Elden Ring Wiki	Magic	Sorceries	"One of the sorceries of the Carian royal family.
Creates a defensive arch of magic glintblades overhead, whichautomatically attack nearby foes.This sorcery can be cast while in motion.
Bestowed upon the enchanted Carian knights, who combined thisart with their swordsmanship to maintain pressure upon theirfoes, striking in waves of steel and sorcery.
"
Blessing of the Erdtree	Elden Ring Wiki	Magic	Incantations	"One of the ancient Erdtree incantations
Grants a greater blessing to the caster and nearby allies, gradually restoring a large amount of HP.Hold to continue praying and delay activation.
The Erdtree once flourished with abundance- yet it was only for a fleeting moment. Such is the course of all life. 
"
Crystal Burst	Elden Ring Wiki	Magic	Sorceries	"One of the glintstone sorceries of the Academy of Raya Lucaria.Fires a burst of glintstone crystal shards.This sorcery can be cast repeatedly and while in motion. Charging increases potency.A sorcery of the Crystal Cadre, a group of sorcerers who pursued the wisdom of stone - the secrets locked in the faint cogitation of the Crystalians.
"
Lucidity	Elden Ring Wiki	Magic	Sorceries	"One of the sorceries of the Carian royal family.
Alleviates buildup of sleep and madness.
This sorcery can be cast while in motion.
The Carian knights never waver.
"
Loretta's Greatbow	Elden Ring Wiki	Magic	Sorceries	"Sorcery used by Royal Knight Loretta.Creates a magic greatbow and fires a great arrow.Charging enhances potency. Hold to keep the great arrow nocked.It is said that the bow was Loretta's favored weapon.
"
Flame Cleanse Me	Elden Ring Wiki	Magic	Incantations	"One of the incantations of the Fire Monks.Creates a fire within that burns away toxins.Alleviates poison and scarlet rot buildup and cures these ailments.This incantation leaves the caster with subtle burns - a reminderthat they must fear the flame.
"
Ranni's Dark Moon	Elden Ring Wiki	Magic	Sorceries	"Legendary sorcery associated with the Carian queen. 
Uses the caster as a vessel to incarnate a cold, dark moon, then sends it floating toward foes. The dark moon dispels all sorcery that touches it, and temporarily reduces magic damage negation for those it strikes.
This moon was encountered by a young Ranni, led by the hand of her mother, Rennala. What she beheld was cold, dark and veiled in occult mystery.
"
Scholar's Shield	Elden Ring Wiki	Magic	Sorceries	"One of the glintstone sorceries of the Academy of Raya Lucaria.
Enchants shield held in the left hand with additional damage negation.This sorcery can be cast while in motion.
Taught to the Knights of the Cuckoo by the academy as payment for their contract.
"
Greyoll's Roar	Elden Ring Wiki	Incantations	+	"Superior incantation of Dragon Communion.Channels the power of Greyoll, the Elder Dragon.An incantation of legendary status.
Transforms caster into a dragon to emit a terrible roar, reducing 
the attack power and defense of nearby enemies.
Greyoll was the mother of all dragons, dwarfing all who stood 
before her like a looming mountain.
"
Fortissax's Lightning Spear	Elden Ring Wiki	Magic	Incantations	"Incantation that channels the power of the ancient dragon Fortissax. 
creates two spears of red lightning and stabs them into the ground from above, one after another. On impact, each spear will burst into trails of lightning covering the area.
During the War of the Anicent Dragons, these twin red lightning stakes were the hallmark of the once ancient dragon who was called the mightiest boulderstone. 
"
Catch Flame	Elden Ring Wiki	Magic	Incantations	"Incantation originating from a sinister prophecy.
Momentarily sparks flame from the caster's hand. This incantation can be cast without delay after performing another action. 
The flame of ruin is anathema to the Erdtree. But prophets sometimes glimpse it within the faith all the same. Sadly when this occurs their sole reward is banishment. 
"
Comet Azur	Elden Ring Wiki	Magic	Sorceries	"Legendary sorcery devised by Azur, primeval sorcerer.
Fires a tremendous comet in a torrent akin to the distant starry expanse, the place said to be the origin of glintstone.Hold to continue releasing the sorcery's power.
When Azur glimpsed into the primeval current, he saw darkness. He was left both bewitched and fearful of the abyss.
"
Inescapable Frenzy	Elden Ring Wiki	Magic	Incantations	"Incantation originating from the maddening Three Fingers.
Causes the yellow flame of frenzy to blaze from the caster's eyes.
The caster then latches onto foes, spreading the madness.
This incantation also causes buildup of madness in the caster, and
is only effective against Tarnished.
To gaze into one another's eyes is truly the most intimate form of
human contact.
"
Crystal Torrent	Elden Ring Wiki	Magic	Sorceries	"Sorcery of the mysterious Crystalians.
Creates a mass of crystal, then fires off shards in rapid succession. Hold to continue firing shards.
The wrath of the Crystalians encapsulated in sorcery. Each shard is of substantial size, making even a stray blow capable of inflicting a severe wound. 
"
Stone of Gurranq	Elden Ring Wiki	Magic	Incantations	"Superior incantation taught by Gurranq, the Beast Clergyman.
Hurls a boulder before the caster.
This incantation can be cast repeatedly.
Long ago, Gurranq was a beast of such terrifying ferocity that his
former name meant ""Death of the Demigods.""
"
Great Oracular Bubble	Elden Ring Wiki	Magic	Sorceries	"Sorcery of the claymen who served as priests in the ancient
 dynasty.
Produces a gigantic magical bubble that drifts towards foes before 
it naturally ruptures. Charging increases the delay before the bubble pops.
The claymen search for lost oracles within their bubbles.
"
Flame Fall Upon Them	Elden Ring Wiki	Magic	Incantations	"One of the incantations that draws directly from the power of the
Fire Giants.
Hurls several balls of fire at once.
Charging enhances potency and causes the balls offire to explode.
There is no record of this incantation in common prayerbooks.
Only a select few prelates know of its existence.
"
Barrier of Gold	Elden Ring Wiki	Magic	Incantations	"One of the incantations of Erdtree Worship. 
Greatly increases magic damage negation for the caster and nearby allies.
Hold to continue praying and delay activation.
This incantation was used by the champions of the Erdtree in the First and the Second Liurnian Wars, during which the red-haired Radagon joined the heroes' ranks
"
Glintstone Stars	Elden Ring Wiki	Magic	Sorceries	"One of the glintstone sorceries of the Academy of Raya Lucaria.
Fires three magic shooting stars that pursue the target.This sorcery can be cast while in motion. Charging enhancespotency.
A sorcery of the Olivinus Conspectus, which attracts sorcerers from Sellia, Town of Sorcery.
"
Zamor Ice Storm (Spell)	Elden Ring Wiki	Magic	Sorceries	"Ice sorcery of the Town of Zamor.
Strike the ground with the staff to create a freezing tornado.
Charging enhances potency.
Cloaked in icy tempests, the knights of Zamor have challenged
the Fire Giants since ancient times.
"
Adula's Moonblade	Elden Ring Wiki	Magic	Sorceries	
Agheel's Flame	Elden Ring Wiki	Magic	Incantations	"Superior incantation of Dragon Communion.Channels the power of the flying dragon Agheel.
Transforms caster into a dragon to spew flaming breath from
above.Charging extends duration. This incantation can be used while
 jumping.
The dead gazed at the skies over the lakes of Limgrave, praying 
that the dragons' flames would burn them to ash.
"
Dragonmaw	Elden Ring Wiki	Magic	Incantations	"One of the incantations of Dragon Communion.
Transforms caster into a dragon to bite enemies before them.
Incantations of those who have hunted dragons and feasted upon their hearts. Theirs is a pure and overwhelming power.
"
Bestial Sling	Elden Ring Wiki	Magic	Incantations	"Incantation taught by Gurranq, the Beast Clergyman.Swiftly flings a number of sharp rock shards.This incantation can be cast without delay after performing another action. It is said that in the time before the Erdtree, stones were the firstweapons of the beasts who had gained intelligence.
"
Meteorite	Elden Ring Wiki	Magic	Sorceries	"One of the glintstone sorceries that manipulates gravitational forces.
Summons a void that emits a rain of small meteorites.Hold to continue the effect.
The sorcery originates from the Onyx Lords, who had skin of stone, and were called lords in reverential fear of their destructive power.
"
Crystal Barrage	Elden Ring Wiki	Magic	Sorceries	"One of the glintstone sorceries of the Academy of Raya Lucaria.
Fires a volley of glintstone crystal shards.Charging increases potency.
A sorcery of the Crystal Cadre, a group of sorcerers who pursue the wisdom of stone - the secrets locked in the faint cogitation of the Crystalians.
"
Bloodflame Blade	Elden Ring Wiki	Magic	Incantations	"A Blood Oath incantation, granted by the Lord of Blood.
Engulfs armament held in the right hand with bloodflame.This incantation can be cast while in motion.
After dealing damage, bloodflame continues to build up onset of blood loss for a very short time.
"
Scholar's Armament	Elden Ring Wiki	Magic	Sorceries	"One of the glintstone sorceries of the Academy of Raya Lucaria.
Enchants armaments held in the right hand with magic-affinity attacks.This sorcery can be cast while in motion.
Taught to the Knights of the Cuckoo by the academy as payment for their contract.
"
Founding Rain of Stars	Elden Ring Wiki	Magic	Sorceries	"The eldest primeval sorcery, said to have been discovered by an
ancient astrologer. A sorcery of legendary status.
Summons a dark cloud of stars overhead. Shortly after, the cloud
will release a violent deluge of star rain. This sorcery can be cast
while in motion. Charging increases potency.
Thought to be the founding glintstone sorcery. The glimpse of the
primeval current that the astrologer saw became real, and the
stars' amber rained down on this land.
"
Lightning Strike	Elden Ring Wiki	Magic	Incantations	"One of the incantations of the capital's ancient dragon cult.
Summons a bolt of lightning that scatters and spreads around the surrounding area.This incantation can be cast repeatedly.
Ancestors of the modern dragons, the ancient dragons had scales of Gravel Stone and wielded lightning as their weapon. It is said that they once attacked Leyndell, the Royal Capital.
"
Swift Glintstone Shard	Elden Ring Wiki	Magic	Sorceries	"One of the glintstone sorceries of the Academy of Raya Lucaria.The glintstone serves as a conduit, launching swift magical projectiles at foes.This sorcery can be used without delay after performing another action.Those unworthy of the stone crown typically end their brief journey into sorcery here.
"
O Flame!	Elden Ring Wiki	Magic	Incantations	"Incantation of the Fire Monks.
Momentarily sparks roaring flame from the caster's hand.Charging enhances potency.
The Giants' Flame still smolders upon the distant northernmountaintop, and the Fire Monks are its guardians.
"
Briars of Sin	Elden Ring Wiki	Magic	Sorceries	"An aberrant sorcery discovered by exiled criminals.
Theirs are the sorceries most reviled by the academy.
Wounds the caster with thorns of sin, creating a spiral of bloodthorns.
This sorcery can be cast repeatedly, up to three times.
"
The Flame of Frenzy	Elden Ring Wiki	Magic	Incantations	"Incantation originating from the maddening Three Fingers.
Causes the yellow flame of frenzy to burst forth from the caster's eyes.
Charging increases the range of the burst.
The flame of frenzy deals damage and causes buildup of madness. This incantation also causes buildup of madness in the caster, and is only effective against Tarnished.
"
Unendurable Frenzy	Elden Ring Wiki	Magic	Incantations	"Incantation originating from the maddening Three Fingers. Causes the yellow flame of frenzy to violently burst forth from the caster's eyes. Hold to continue channeling the flame. This incantation can be used while in motion. It is the maddening pain and unstoppable tears of those afflicted with the flame of frenzy brought into being. 
"
Shattering Crystal	Elden Ring Wiki	Magic	Sorceries	"Sorcery of the mysterious Crystalians.Creates a mass of crystal, then shatters it in a forward burst.Charging enhances potency.The Crystalians are inorganic beings, yet they live. They cleave close to the ideals of the primeval current, and as such, they are revered guests of the sorcerers.
"
Ekzykes's Decay	Elden Ring Wiki	Magic	Incantations	"Superior incantation of Dragon Communion.Channels the power of Ekzykes, the Decaying.
Transforms caster into a dragon to spew scarlet rot breath from
above.Charging extends duration. This incantation can be cast while
 jumping.
Ekzykes, Dragon Communion Revenger, did not forget his hatred even as he succumbed to the scarlet rot.
"
Comet	Elden Ring Wiki	Magic	Sorceries	
Eternal Darkness	Elden Ring Wiki	Magic	Sorceries	"Forbidden sorcery of Sellia, Town of Sorcery.
Creates a space of darkness that draws in sorceries and
incantations.
This sorcery can be cast while in motion.
Originally a lost sorcery of the Eternal City; the despair that
brought about its ruin made manifest.
"
Cannon of Haima	Elden Ring Wiki	Magic	Sorceries	"One of the glintstone sorceries of the Academy of Raya Lucaria.Lobs an explosive magic projectile that flies in an arc.Charging enhances potency.Drawn from the conspectus of Haima, the adjudicator of the academy, this sorcery employs might as a means to quell conflict.
"
Magic Glintblade	Elden Ring Wiki	Magic	Sorceries	"An old sorcery of the Carian Royal Family.
Creates a sigil overhead, from which an enemy-seeking glintblade appears after a brief delay. This sorcery can be used while in motion. 
Charging increases the delay. Said to be the prototype of the sword-phalanx soerceries wielded by royal enchanted knights
"
Bestial Vitality	Elden Ring Wiki	Magic	Incantations	"Incantation taught by Gurranq, the Beast Clergyman.
Fills the body with bestial vigor, restoring HP over a period of time.
Having gained intelligence, the beasts must have felt how their wildness slipped away as civilization took hold.
"
Gravity Well	Elden Ring Wiki	Magic	Sorceries	"One of the glintstone sorceries that manipulates gravitational forces.Fires a projectile of condensed gravitational force. Those struck by it will be pulled toward the caster.Charging enhances potency.A gravitational technique studied by the young Radahn. His master was an Alabaster Lord with skin of stone.
"
Poison Armament	Elden Ring Wiki	Magic	Incantations	"Incantation of the servants of rot.
Enchants armament held in the right hand with poison.This incantation can be cast while in motion.
Those who dwell within poison know rot all too well. The death that begets life, that comes to all equally. That is to say: it is the cycle of rebirth put into practice.
"
Dragonclaw	Elden Ring Wiki	Magic	Incantations	"One of the incantations of Dragon Communion.
Transforms caster into a dragon to tear through foes with dragon claws. Allows one follow-up attack.
Incantation of those who have hunted dragons and feasted upon their hearts. This is a pure and overwhelming power.
"
Flame Sling	Elden Ring Wiki	Magic	Incantations	"An incantation from the Fire Monks, guardians of the giants' flame of ruin. Produces and throws a ball of raging fire. Charging up this incantation makes it more powerful and cases the ball to explode. Fire beguiles those who look upon it. Those who would guard the flame would also come to worship it.
"
Carian Phalanx	Elden Ring Wiki	Magic	Sorceries	"One of the sorceries of the Carian royal family.
Creates a defensive arch of numerous magic glintblades overhead, 
which automatically attack nearby foes.This sorcery can be used cast while in motion.
An enhanced version of the glintblade sorcery used by enchanted
 knights.
"
Golden Lightning Fortification	Elden Ring Wiki	Magic	Incantations	"An incantation of Erdtree Worship.
Greatly increases lightning damage negation for the caster and nearby allies.
Hold to continue praying, delaying the effect.
This incantation was used by the knights of the Erdtree during the assault by the great ancient dragon Gransax, and the bitter War of the Ancient Dragons that followed.
"
Great Heal	Elden Ring Wiki	Magic	Incantations	"Superior incantation of the Two Fingers' faithful.
Greatly heals HP for the caster and nearby allies. Hold to continue praying and delay activation.
The Two Fingers has high hopes for the Tarnished; that even if they should be wounded, even should they fall, they will continue to fight for their duty.
"
Greatblade Phalanx	Elden Ring Wiki	Magic	Sorceries	"One of the sorceries of the Carian royal family.Creates a defensive arch of larger magic glintblades overhead, which automatically attack nearby foes.Used by the enchanted troll knights.They were the comrades of the young Rennala, bound by oath.
"
Flame of the Fell God	Elden Ring Wiki	Magic	Incantations	"This legendary incantation is one of several that draws directlyfrom the power of the Fire Giants.Releases a ball of raging fire said to be inhabited by a fell god. Thefireball floats toward enemies and explodes, setting the areaablaze.Arghanthy, the chief guardian of the Flame, had kept this incantation a well-kept secret until it was stolen by Adan. The fell god still lurks within the Fire Giants.
"
Glintstone Cometshard	Elden Ring Wiki	Magic	Sorceries	"One of the glintstone sorceries of the Academy of Raya Lucaria.Fires a magical comet with a trailing tail.This sorcery can be cast repeatedly and while in motion. Charging enhances potency.A sorcery of the Karolos Conspectus, the most venerable of the academy.
"
Night Comet	Elden Ring Wiki	Magic	Sorceries	"One of the night sorceries of Sellia, Town of Sorcery.
Fires a semi-invisible magic comet.This sorcery can be cast repeatedly and while in motion. Charging enhances potency.
The Sellian sorcerers were assassins, and it is said that they often hunted their fellows.
"
Elden Stars	Elden Ring Wiki	Magic	Incantations	"This legendary incantation is the most ancient of those that derive from the Erdtree.
Creates a stream of golden shooting stars that assail the area.
It is said that long ago, the Greater Will sent a golden star bearing a beast into the Lands Between, which would later become the Elden Ring.
"
Glintstone Arc	Elden Ring Wiki	Magic	Sorceries	"Fires a horizontal arc of magic that spreads outward.This sorcery can be cast repeteadly and while in motion.
Granted to sorcererers who depart from the academy to embark on
journeys, in order to fend off large groups of would-be adversaries.
Fools often roam in packs.
"
Lord's Divine Fortification	Elden Ring Wiki	Magic	Incantations	"Incantation taught to Gideon the All-Knowing by the Two 
Fingers.
Greatly increases holy damage negation for the caster and nearby 
allies.
Hold to continue praying and delay activation.
Gideon gained true knowledge after his long exchange with the 
Two Fingers - discovering all had been broken long ago; that the 
trembling fingers, bent with age, and the Erdtree itself, were no 
exception.
"
Ambush Shard	Elden Ring Wiki	Magic	Sorceries	"One of the night sorceries of Sellia, Town of Sorcery.Launches a projectile from a distance removed from the caster, so as to strike the enemy from behind.This sorcery can be cast repeatedly.The Sellian sorcerers were assassins, and it is said that they often hunted their fellows.
"
Frenzied Burst	Elden Ring Wiki	Magic	Incantations	"Incantations originating from the maddening Three Fingers.
Releases concentrated blasts of the yellow flame of frenzy from the caster's eyes.
Charging enhances potency, enabling the blasts to penetrate the enemy's guard.
In times past, every single person who attempted to control the flame of frenzy succumbed to madness after a desperate internal struggle. This incantation is testament to a meager victory.
"
Black Flame's Protection	Elden Ring Wiki	Magic	Incantations	"A black flame incantation of the Godskin Apostles.
Summons black fire within, increasing physical damage negation. 
However, sacred flasks and other such forms of HP restoration are 
impaired.
The Apostles were all embraced by the Gloam-Eyed Queen, and 
the black flame was their armor within.
"
Discus of Light	Elden Ring Wiki	Magic	Incantations	"One of the incantations of the Golden Order fundamentalists.
Produces a ring of light and fires it forwards. The ring of light returns to a position close to the caster before disappearing. This incantation can be cast repeatedly.
A gift from the young Miquella to his father, Radagon.
"
Scouring Black Flame	Elden Ring Wiki	Magic	Incantations	"A black flame incantation of the Godskin Apostles.Sweeps a wide area before the caster with black flame.Charging enhances range.The black flame could once slay gods. But when Maliketh sealed Destined Death, the true power of the black flame was lost.
"
Pest Threads	Elden Ring Wiki	Magic	Incantations	"Incantation of the servants of rot.
Secretes countless sticky threads, launching them forwards.
A technique of the pale pests who crawl through the lands afflicted by scarlet rot; the abandoned children of the goddess.
""Do you have an interest in rot incantations?""
"
Honed Bolt	Elden Ring Wiki	Magic	Incantations	"One of the incantations of the capital's ancient dragon cult.
Summons a bolt of lightning to strike foes from above.This incantation can be cast repeatedly.
Long ago, Godwyn the Golden defeated the ancient dragon
 Fortissax, and befriended his fallen foe — an event that gave rise to
 the ancient dragon cult in the capital.
"
