item	site	category	subcategory	description
Black Dragon Set	Dark Souls 2 Wiki	Armor	+	"Black Dragon Set is an Attire or Armor in Dark Souls 2. Armor sets do not provide specific benefits, so players are free to mix and match their preferred parts to optimize their Builds.
"
Nahr Alma Set	Dark Souls 2 Wiki	Armor	+	"Nahr Alma Set is an Attire or Armor in Dark Souls 2. Armor sets do not provide specific benefits, so players are free to mix and match their preferred parts to optimize their  Builds
   ""Hood/Robes worn by servants of Nahr Alma, god of blood. Increases souls acquired for each kill. Belonged to Titchy Gren.  Those who profess faith in Nahr Alma have rejected all that is this world, and vow to travel a path stained with blood.""   From Beta:  ""Armor worn by Titchy Gren.   Blessed with the protection of the god of war Nahr Alma. This armor is much heavier than it looks, overwhelmed by the blood that it has absorbed.""
"
Hunter Set	Dark Souls 2 Wiki	Armor	+	"Hunter Set is an Attire or Armor in Dark Souls 2. Armor sets do not provide specific benefits, so players are free to mix and match their preferred parts to optimize their Builds.
   ""An old armor that is oddly comfortable. Belonged to a Hunter. To this day, the forbidden love of Prince of Alken and the Princess of Venn manipulates these marionettes. Surely they never imagined that their dolls would outlast their own kingdoms.""
"
Throne Defender Set	Dark Souls 2 Wiki	Armor	+	"Throne Defender Set is an Attire or Armor in Dark Souls 2. Armor sets do not provide specific benefits, so players are free to mix and match their preferred parts to optimize their Builds.
    ""[armor piece] worn by the Throne Defender.  The Defender has stood by the throne for ages. Will his wait be worth the while?""   
"
Velstadt's Set	Dark Souls 2 Wiki	Armor	+	"Velstadt's Set is an Attire or Armor in Dark Souls 2. Armor sets do not provide specific benefits, so players are free to mix and match their preferred parts to optimize their Builds.
  ""Helmet/Armor/Gauntlets/Leggings worn by the Royal Aegis. Originally imbued with the power of miracles, now soaked with dark after extended exposure in the Undead Crypt.  A knight from a faraway land was lured to this accursed land, but forgot even why he came, eventually reduced to a shadow of his former self.""
"
Alva Set	Dark Souls 2 Wiki	Armor	+	"Alva Set is an Attire or Armor in Dark Souls 2. Armor sets do not provide specific benefits, so players are free to mix and match their preferred parts to optimize their Builds.
  ""Helmet/Armor/Gauntlets/Leggings worn by Alva the Wayfarer  Light but offers very high defense.  Alva crossed many a land in search of a cure for Saint Serreta's sickness, but failed and relinquished his knighthood.   Scholar of the First Sin changed to:  Light but offer very high defense.  Alva crossed many a land in search of a cure for Saint Serreta's sickness, but failed and relinquished his knighthood.  Alva was once wracked with guilt and remorse, but rediscovered his purpose in life with the aid of the witch who once plotted against him.""
"
Benhart's Set	Dark Souls 2 Wiki	Armor	+	"Benhart's Set is an Attire or Armor in Dark Souls 2. Armor sets do not provide specific benefits, so players are free to mix and match their preferred parts to optimize their Builds.
"
White Priest Set	Dark Souls 2 Wiki	Armor	+	"White Priest Set is an Attire or Armor in Dark Souls 2.
    Hood changed to: ""Hood worn by a White Priest sorcerer. The man claims to have sealed himself away, but who's ever heard of sentient magic?  It is no doubt difficult to judge the veracity of the man's words, but this hood certainly seems to possess an unusual power.""  ""Robe/Gloves/Leggings worn by a White Priest sorcerer. He calls himself Navlaan, now.""   
"
Astrologist's Set	Dark Souls 2 Wiki	Armor	+	" Astrologist's Set is an Attire or Armor in Dark Souls 2. Armor sets do not provide specific benefits, so players are free to mix and match their preferred parts to optimize their Builds.
   ""Astrologists believe that magical powers can be obtained at moments of special heavenly alignment.  Even the collective wisdom of the Melfian Magic Academy cannot pull magic out of the sky, but the ideas of the astrologists led to the creation of new and very useful magic devices.""
"
Wanderer Set	Dark Souls 2 Wiki	Armor	+	"Wanderer Set is an Attire or Armor in Dark Souls 2. Armor sets do not provide specific benefits, so players are free to mix and match their preferred parts to optimize their Builds.
     ""A hood/coat/manchettes/boots for the roving type.  Light, sturdy leather made for long journeys.""  
"
Catarina Set	Dark Souls 2 Wiki	Armor	+	"Catarina Set is an Attire or Armor in Dark Souls 2. Armor sets do not provide specific benefits, so players are free to mix and match their preferred parts to optimize their Builds.
    ""Helm/Armor/Gauntlets/Leggings-Distinctively shaped apparel worn by the Knights of Catarina.  Outside Catarina, they are often ridiculed for their Onion-like shape, infuriating the proud knights, but masterfully forged curved design makes it very effective for parrying.""  Changed to:  ""Odd helmet/armor/gauntles/leggings shaped like an onion.  This [armor piece] appears rather absurd, but its multi-faced construction is in fact quite practical as it effectively deflects physical attacks.  The old tales speak of brave Catarina knight wearing this [armor piece] as they rushed courageously into battle.""
"
Executioner Set	Dark Souls 2 Wiki	Armor	+	"Executioner Set is an Attire or Armor in Dark Souls 2. Armor sets do not provide specific benefits, so players are free to mix and match their preferred parts to optimize their Builds.
   ""Black Helmet/Armor/Gauntlets/Leggings worn by the executioner of the Undead Purgatory. The spikes are designed to evoke fear.  The executioner mercilessly put down countless Undead, but how could he know that it was never his own will, but that of the chariot horse?""
"
Syan's Set	Dark Souls 2 Wiki	Armor	+	"Syan's Set is an Attire or Armor in Dark Souls 2. Armor sets do not provide specific benefits, so players are free to mix and match their preferred parts to optimize their Builds.
   ""Replica of the armor of the loyal knight Syan. This solidly-crafted gear offers high defense.  Sir Syan was widely known as the Kingdom's most loyal knight, and when the Giants invaded, he volunteered to lead the advance party, but he was slaughtered most dishonorably.  The King commissioned replicas of Syan's accoutrements and bestowed them on promising knights, but not long after they donned the armor did most go thoroughly mad.""
"
Drangleic Set	Dark Souls 2 Wiki	Armor	+	"Drangleic Set is an Attire or Armor in Dark Souls 2. Armor sets do not provide specific benefits, so players are free to mix and match their preferred parts to optimize their Builds.
   ""A traditional Drangleic helmet. Belonged to Captain Drummond.  In his day, King Vendrick was fair and just, and expected the same of his liegemen.  This helm was proof of King Vendrick's trust, an honor, until his transfiguration.""  ""Traditional Drangleic Armour/Gauntlets/Leggings. Belonged to Captain Drummond.  Drummond's ancestors have served Drangleic for generations, principally as defenders of the great fort, but Captain Drummond is the last in this proud line."" 
"
Black Witch Set	Dark Souls 2 Wiki	Armor	+	"Black Witch Set is an Attire or Armor in Dark Souls 2. Armor sets do not provide specific benefits, so players are free to mix and match their preferred parts to optimize their Builds.
  ""Robe worn by Zullie the witch,seducer of Alva of Wayfarer. Boasts excellent magic defense.  When Zullie the witch learned of Alva's dedication to Saint Serrate she used all manner of tricks and deceit to ruin him, but in the end she would spend her life with him, supporting his endeavors.""  Scholar of the First Sin added:  ""The witch, as unloving as she was unloved, finally found illumination through her blighted existence.""
"
Imported Set	Dark Souls 2 Wiki	Armor	+	"Imported Set is an Attire or Armor in Dark Souls 2. Armor sets do not provide specific benefits, so players are free to mix and match their preferred parts to optimize their Builds.
"
Tseldora Set	Dark Souls 2 Wiki	Armor	+	"Tseldora Set is an Attire or Armor in Dark Souls 2. Equipping entire armor sets often does not provide specific benefits (though specific pieces may provide augments), so players are free to mix and match their preferred parts to optimize their Builds.
   ""Outfit worn by settlers of Tseldora. Rather fancy but with low defence and unfit for battle.  Its design recalls Tseldora's glory days, the peak of the brightstone boom.""   Scholar of the First Sin changed to:  ""[Armor piece] worn by settlers of Tseldora. Rather fancy but with low defense and unfit for battle.""  Cap: ""Tseldora flourished with the discovery of brightstone, deep under the settlement. But with this prosperity came greed in equal measure, and the people were ever in search of that which they lacked.""  Rest: ""The brightstone that brought prosperity to Tseldora served only to stoke the flames of its peoples' desires, eventually leading to its ruin. Those bewitching, brilliantly gleaming stones are said to be fragments of a being that once roamed the entrails of the earth.""     
"
Hollow Infantry Set	Dark Souls 2 Wiki	Armor	+	"Hollow Infantry Set is an Attire or Armor in Dark Souls 2. Armor sets do not provide specific benefits, so players are free to mix and match their preferred parts to optimize their Builds.
     ""Helm (Armor/Gloves/Boots) worn by Hollowed infantry.""  ""A piece of basic, minimal equipment. Worse yet, they're worn and nearly falling apart. Not recommended unless your options are spent.""
"
Mad Warrior Set	Dark Souls 2 Wiki	Armor	+	"Mad Warrior Set is an Attire or Armor in Dark Souls 2. Armor sets do not provide specific benefits, so players are free to mix and match their preferred parts to optimize their Builds.
   ""[armor piece] from an unknown foreign land.  King Vendrick called upon powers from beyond his borders in an attempt to stave off the curse. Perhaps they belonged to one of his guests.""
"
Insolent Set	Dark Souls 2 Wiki	Armor	+	"Insolent Set is an Attire or Armor in Dark Souls 2. Armor sets do not provide specific benefits, so players are free to mix and match their preferred parts to optimize their Builds.
"
Creighton's Set	Dark Souls 2 Wiki	Armor	+	"Creighton's Set is an Attire or Armor in Dark Souls 2. Armor sets do not provide specific benefits, so players are free to mix and match their preferred parts to optimize their Builds.
   ""A typical steel mask. Belonged to Creighton the Wanderer. Its design resembles that of the knight order of the eastern land of Mirrah, but with some odd differences that catch the eye. Perhaps it is a finely-crafted imitation.""
"
Royal Soldier Set	Dark Souls 2 Wiki	Armor	+	"Royal Soldier Set is an Attire or Armor in Dark Souls 2. Armor sets do not provide specific benefits, so players are free to mix and match their preferred parts to optimize their Builds.
"
Bandit Set	Dark Souls 2 Wiki	Armor	+	"Bandit Set is an Attire or Armor in  Dark Souls 2. Armor sets do not provide specific benefits, so players are free to mix and match their preferred parts to optimize their Builds.
  ""Helmet/Gauntlets/Armor/Boots of bandits of the Forossan outskirts.  The territory of Forossa became lawless after the kingdom fell to war. Citizens became bandits, and scattered to other lands.""
"
Moon Butterfly Set	Dark Souls 2 Wiki	Armor	+	"Moon Butterfly Set is an Attire or Armor in Dark Souls 2. Armor sets do not provide specific benefits, so players are free to mix and match their preferred parts to optimize their Builds.
""Hat/pinions/cuffs/skirt made from wings of the rare moon butterfly. Poisons those who approach its wearer.""  ""Also extends jump distance.""  ""Little is known about the moon butterfly, which only appears on full-moon nights in winter. Some say the butterfly is a magical being, and its larvae have never once been spotted.""  Effect(all): Poisons nearby foes  Wings/Skirt Effect: Increases length of jump
"
Xanthous Set	Dark Souls 2 Wiki	Armor	+	"Xanthous Set is an Attire or Armor in Dark Souls 2. Armor sets do not provide specific benefits, so players are free to mix and match their preferred parts to optimize their Builds.
     ""This blindingly-bright yellow costume is said to have been worn by Xanthous King.  Perhaps the heinously towering head cloth crown served some purpose, or perhaps it was some strange display of power""  Despite the costume's being in near tatters, its yellow hues are mysteriously unfaded.""
"
Prisoner's Set	Dark Souls 2 Wiki	Armor	+	"Prisoner's Set is an Attire or Armor in Dark Souls 2. Armor sets do not provide specific benefits, so players are free to mix and match their preferred parts to optimize their Builds.
     ""Rags worn by imprisoned Hollows. This appears to have been worn on the head (body, arms, hip).  Judging by its looks and apparent virtues, this really is no more than a tattered scrap of cloth. It still carries the stench of a Hollow.""   
"
Black Hollow Mage Set	Dark Souls 2 Wiki	Armor	+	"Black Hollow Mage Set is an Attire or Armor in Dark Souls 2. Armor sets do not provide specific benefits, so players are free to mix and match their preferred parts to optimize their Builds.
"
Bone King Set	Dark Souls 2 Wiki	Armor	+	"Bone King Set is an Attire or Armor in Dark Souls 2. Armor sets do not provide specific benefits, so players are free to mix and match their preferred parts to optimize their Builds.
    ""Skeleton lord Helmet/Armor/Gauntlets/Boots.High dark defense.""  Crown: ""The Old Iron King led his best men on Undead hunts, but their memories were purged in rebirth.""  Rest of Set: ""The very men who were ordered to hunt down the Undead were themselves hollowed, and founded a kingdom of bone.""
"
Royal Swordsman Set	Dark Souls 2 Wiki	Armor	+	"Royal Swordsman Set is an Attire or Armor in Dark Souls 2. Armor sets do not provide specific benefits, so players are free to mix and match their preferred parts to optimize their Builds.
     Helmet/Armor of a royal swordsman. Its shape provides defense while allowing great mobility. Stripped of ornamentation, this particular helm/armor is designed strictly for battle.  King Vendrick supplied his bravest men with the best armor available to face the great giants, but very few returned alive."" 
"
Shadow Set	Dark Souls 2 Wiki	Armor	+	"Shadow Set is an Attire or Armor in Dark Souls 2. Armor sets do not provide specific benefits, so players are free to mix and match their preferred parts to optimize their Builds.
    ""Used to hide in the cover of night. Those who are especially adept assassins are often hired as bodyguards.  In an attempt to stave off the curse, King Vendrick hired shadowmen to put down the Hollows, but before long they were Hollowed themselves""
"
Vengarl's Set	Dark Souls 2 Wiki	Armor	+	"Vengarl's Set is an Attire or Armor in Dark Souls 2.
   ""An old armor that is oddly comfortable. Belonged to a Vengarl's. To this day, the forbidden love of Prince of Alken and the Princess of Venn manipulates these marionettes. Surely they never imagined that their dolls would outlast their own kingdoms.""     
  
  
First row = Regular. Second row = +5
  
I swear a third of the player ghosts I see are wearing this set or at least a piece of it.
"
Rusted Mastodon Set	Dark Souls 2 Wiki	Armor	+	"Rusted Mastodon Set is an Attire or Armor in Dark Souls 2. Armor sets do not provide specific benefits, so players are free to mix and match their preferred parts to optimize their Builds.
    //""Helm/Armor/Gauntlets/Boots worn by the Primal Knights of Drangleic castle. Durability is low due to rusting.  Its weight would normally crush a man, but to the brutish Primal Knights it may as well be made of papyrus.""…/ 
"
Saint's Set	Dark Souls 2 Wiki	Armor	+	"Saint's Set is an Attire or Armor in Dark Souls 2. Armor sets do not provide specific benefits, so players are free to mix and match their preferred parts to optimize their Builds.
     ""Hood worn by miracle-casting clerics. Grants slight increase to spell uses. Belonged to Licia of Lindelt.  Lindelt is founded upon stringent commandments. Its inhabitants often travel to distant lands for ascetic training, but more than a few of these trainees liberate themselves from Lindelt's teachings in the process""  ""Dress/gloves/trousers worn by miracle-casting clerics. belonged to Licia of Lindelt.  While its true Licia dedicated herself to miracles, its rare for anyone to pass through life without trouble. even clerics arent always who they seem.""  
"
Judgment Set	Dark Souls 2 Wiki	Armor	+	"Judgment Set is an Attire or Armor in Dark Souls 2. Armor sets do not provide specific benefits, so players are free to mix and match their preferred parts to optimize their Builds.
  
""A mask/robe/manchettes/tights honoring an ancient goddess. Sin was said to be her domain, but the name of the goddess is long forgotten.""  ""Little is known about what purpose the mask/robe/manchettes/tights served, only that it was worn by a person of great authority.""
"
Alonne Captain Set	Dark Souls 2 Wiki	Armor	+	"Alonne Captain Set is an Armor Set in Dark Souls 2. Armor sets do not provide specific benefits, so players are free to mix and match their preferred parts to optimize their Builds.
"
